{
  "schema": "dailyfuel/map-roads/1",
  "source": "NTAD National Highway Freight Network, U.S. DOT BTS (Federal Highway Administration data)",
  "source_url": "https://services.arcgis.com/xOi1kZaI0eWDREZv/arcgis/rest/services/NTAD_National_Highway_Freight_Network/FeatureServer/0",
  "licence": "Public domain, a work of the United States government, available for unrestricted public use",
  "attribution": "Roads: NTAD National Highway Freight Network, U.S. DOT BTS, public domain",
  "licence_note": "The NHFN Version 2023.02.08 database, or any portion thereof, can be freely distributed as long as this metadata entry is included with each distribution. The original metadata entry cannot be modified or deleted from any data transfer. This NTAD dataset is a work of the United States government as defined in 17 U.S.C. § 101 and as such are not protected by any U.S. copyrights. This work is available for unrestricted public use.",
  "version": "2023.02.08",
  "compiled": "2023-01-27",
  "data_edited": "2026-05-13",
  "fetched": "2026-09-24",
  "query_url": "https://services.arcgis.com/xOi1kZaI0eWDREZv/arcgis/rest/services/NTAD_National_Highway_Freight_Network/FeatureServer/0/query?where=1%3D1&outFields=SIGN1%2CNHFN_CODE%2CST_NAME&outSR=4326&geometryPrecision=4&orderByFields=OBJECTID&resultOffset=0&resultRecordCount=1000&f=json",
  "codes": {
    "1": "Primary Highway Freight System",
    "2": "Interstate not on the Primary Highway Freight System"
  },
  "signs": "SIGN1 from the source with spaces and control characters taken out: I for interstate, U for US route, S for state route, C for county route, then the number and any suffix (I35E, U9W). Null where the source has none.",
  "fields": [
    "sign",
    "code",
    "pts"
  ],
  "precision": 2,
  "tolerance_deg": 0.01,
  "encoding": "pts is [x0, y0, dx1, dy1, ...] in units of 10^-precision degrees, lon then lat. Add each pair to the vertex before it to get the next one.",
  "counts": {
    "features": 12989,
    "paths": 12989,
    "dropped_outside_us": 38,
    "lines": 1487,
    "signs": 490,
    "points_before_simplify": 1381673,
    "points": 9169
  },
  "dropped_outside_us": {
    "Puerto Rico": 38
  },
  "lines": [
    [null,1,[-15936,2196,0,-1]],
    [null,1,[-15935,2198,1,0]],
    [null,1,[-15809,2133,-1,-2]],
    [null,1,[-15792,2134,0,-1]],
    [null,1,[-15792,2134,1,0]],
    [null,1,[-15791,2133,-1,1]],
    [null,1,[-15646,2089,-1,0]],
    [null,1,[-15645,2089,1,0]],
    [null,1,[-15603,1973,-1,0]],
    [null,1,[-15506,1971,1,1]],
    [null,1,[-15106,6049,-6,7,-18,0,-3,3,0,3,-5,7]],
    [null,1,[-14997,6118,5,-1]],
    [null,1,[-14991,6118,17,0,1,5]],
    [null,1,[-14989,6122,0,1]],
    [null,1,[-14988,6122,-1,0]],
    [null,1,[-14987,6122,-4,-2]],
    [null,1,[-14987,6122,-3,0]],
    [null,1,[-14986,6112,-5,1,-1,4,2,5]],
    [null,1,[-14910,6456,2,1]],
    [null,1,[-14787,6482,4,2,12,-1]],
    [null,1,[-14782,6482,1,2]],
    [null,1,[-14768,6486,-18,-1]],
    [null,1,[-12314,4406,2,-1]],
    [null,1,[-12277,4564,7,-3]],
    [null,1,[-12276,4559,-1,5]],
    [null,1,[-12276,4561,3,-1,3,1,2,0]],
    [null,1,[-12276,4564,1,0]],
    [null,1,[-12275,4556,5,-2]],
    [null,1,[-12273,4559,16,-3]],
    [null,1,[-12270,4555,0,-1]],
    [null,1,[-12270,4556,2,0]],
    [null,1,[-12270,4564,4,0]],
    [null,1,[-12268,4554,-1,2]],
    [null,1,[-12268,4556,1,-3]],
    [null,1,[-12267,4552,1,0]],
    [null,1,[-12265,4549,1,0]],
    [null,1,[-12261,4557,0,1]],
    [null,1,[-12261,4558,3,0]],
    [null,1,[-12257,4558,-1,-1]],
    [null,1,[-12254,4557,-4,2]],
    [null,1,[-12241,4727,2,-3]],
    [null,1,[-12240,3775,1,0]],
    [null,1,[-12240,4726,0,-1]],
    [null,1,[-12240,4728,4,-3,0,-1]],
    [null,1,[-12238,3774,-1,1]],
    [null,1,[-12237,3791,-1,2]],
    [null,1,[-12236,3791,0,1]],
    [null,1,[-12236,4757,4,0]],
    [null,1,[-12235,3800,4,-1]],
    [null,1,[-12235,4757,0,2]],
    [null,1,[-12231,3780,2,0]],
    [null,1,[-12231,4755,3,-4]],
    [null,1,[-12230,3781,-2,0,3,1]],
    [null,1,[-12230,4747,0,-2]],
    [null,1,[-12222,3749,1,0]],
    [null,1,[-12221,3749,0,1]],
    [null,1,[-12220,3773,0,1]],
    [null,1,[-12219,4798,-2,0]],
    [null,1,[-12214,3804,1,3]],
    [null,1,[-12132,3795,2,-1]],
    [null,1,[-12128,3786,2,0,1,1,3,-1]],
    [null,1,[-12126,3795,2,0]],
    [null,1,[-11976,3669,1,0]],
    [null,1,[-11920,3418,-2,0,1,7]],
    [null,1,[-11907,3422,-1,-6,-2,-1,-10,0,1,3]],
    [null,1,[-11835,3420,1,0]],
    [null,1,[-11828,3375,-1,0,1,2]],
    [null,1,[-11828,3377,3,1]],
    [null,1,[-11826,3375,1,0]],
    [null,1,[-11823,3381,2,-1]],
    [null,1,[-11822,3406,1,0]],
    [null,1,[-11821,3377,-2,1]],
    [null,1,[-11819,3401,2,-1]],
    [null,1,[-11793,3400,0,1]],
    [null,1,[-11791,3399,1,1]],
    [null,1,[-11761,3406,0,1]],
    [null,1,[-11759,3406,0,1]],
    [null,1,[-11754,4763,4,1]],
    [null,1,[-11733,3411,2,0]],
    [null,1,[-11732,4766,-1,2]],
    [null,1,[-11720,3288,9,1]],
    [null,1,[-11718,3273,1,0]],
    [null,1,[-11717,3273,-1,1]],
    [null,1,[-11696,3256,0,-1,2,0]],
    [null,1,[-11217,3346,0,6]],
    [null,1,[-11212,3348,1,0]],
    [null,1,[-11207,3343,0,3]],
    [null,1,[-11204,3344,7,0]],
    [null,1,[-11199,4080,4,1]],
    [null,1,[-11192,4081,0,1]],
    [null,1,[-11191,4079,1,-1]],
    [null,1,[-10668,3178,0,4]],
    [null,1,[-10664,3505,2,0]],
    [null,1,[-10642,3178,2,-2]],
    [null,1,[-10639,3178,-1,2]],
    [null,1,[-10638,3177,0,-2]],
    [null,1,[-10501,3979,0,2]],
    [null,1,[-10499,3980,1,0]],
    [null,1,[-10495,3980,1,0]],
    [null,1,[-10491,3986,-1,-2]],
    [null,1,[-10491,3986,3,0]],
    [null,1,[-10490,3987,0,1]],
    [null,1,[-10475,3983,8,1]],
    [null,1,[-10123,4824,2,-1]],
    [null,1,[-10050,2871,-1,-1]],
    [null,1,[-9947,2754,0,-1]],
    [null,1,[-9947,2768,1,0]],
    [null,1,[-9946,2769,1,-2]],
    [null,1,[-9824,2619,0,-1]],
    [null,1,[-9820,2620,-1,-2,2,0]],
    [null,1,[-9750,2590,-1,-1]],
    [null,1,[-9745,2782,0,-2]],
    [null,1,[-9744,2780,-11,3]],
    [null,1,[-9743,2780,0,1]],
    [null,1,[-9740,2781,-1,-1]],
    [null,1,[-9735,3297,4,0]],
    [null,1,[-9733,3297,-1,2]],
    [null,1,[-9732,3301,3,-1]],
    [null,1,[-9719,3286,0,-2]],
    [null,1,[-9713,3292,0,-1]],
    [null,1,[-9687,3282,4,2]],
    [null,1,[-9685,4693,0,1]],
    [null,1,[-9682,3307,0,-14]],
    [null,1,[-9667,3280,0,-2]],
    [null,1,[-9603,3613,2,0]],
    [null,1,[-9593,4121,0,2]],
    [null,1,[-9593,4127,0,-1]],
    [null,1,[-9544,3011,3,-2,4,-20]],
    [null,1,[-9540,3001,0,1]],
    [null,1,[-9532,2975,4,-1,0,-3]],
    [null,1,[-9531,2979,-1,-2]],
    [null,1,[-9529,2975,0,-1]],
    [null,1,[-9529,2982,0,-2]],
    [null,1,[-9528,2998,-6,0,1,-4]],
    [null,1,[-9527,2972,2,0]],
    [null,1,[-9527,2979,2,0]],
    [null,1,[-9521,2976,3,-1]],
    [null,1,[-9518,2974,0,-3]],
    [null,1,[-9516,2977,0,-2]],
    [null,1,[-9515,2976,5,0]],
    [null,1,[-9512,2978,0,-3]],
    [null,1,[-9503,2960,1,0]],
    [null,1,[-9471,3930,2,1]],
    [null,1,[-9471,3933,-1,-3]],
    [null,1,[-9465,3909,-1,0]],
    [null,1,[-9462,3915,1,0,-1,-4]],
    [null,1,[-9461,3914,1,0]],
    [null,1,[-9454,3915,2,-2]],
    [null,1,[-9370,4156,6,0]],
    [null,1,[-9364,4151,0,7]],
    [null,1,[-9351,4157,-5,0,0,3]],
    [null,1,[-9221,3477,1,0]],
    [null,1,[-9219,3471,2,0]],
    [null,1,[-9219,3472,0,-1]],
    [null,1,[-9218,3477,0,1]],
    [null,1,[-9027,2999,0,-1]],
    [null,1,[-9023,3526,2,-2]],
    [null,1,[-9022,3518,-3,0,-1,1]],
    [null,1,[-9020,3854,0,-3]],
    [null,1,[-9019,3861,-2,-2]],
    [null,1,[-9018,3877,-5,-5,2,-4]],
    [null,1,[-9017,3867,-1,-1]],
    [null,1,[-9014,3515,-3,-2]],
    [null,1,[-9013,3864,2,1]],
    [null,1,[-9009,3037,0,2]],
    [null,1,[-9007,2993,0,1]],
    [null,1,[-9007,3509,-2,-2]],
    [null,1,[-9007,3512,-6,-3]],
    [null,1,[-9006,2998,2,1]],
    [null,1,[-9006,3508,0,1]],
    [null,1,[-9006,3509,-2,0]],
    [null,1,[-8999,3505,0,3]],
    [null,1,[-8999,3505,1,0]],
    [null,1,[-8998,3512,-2,0]],
    [null,1,[-8996,3517,2,1]],
    [null,1,[-8995,3508,-4,-1]],
    [null,1,[-8994,3002,-8,-1]],
    [null,1,[-8962,4067,1,0]],
    [null,1,[-8960,4068,-3,-1]],
    [null,1,[-8959,4066,-1,-1]],
    [null,1,[-8914,3042,2,-2,2,-1,0,-3]],
    [null,1,[-8819,4142,4,0,0,-4]],
    [null,1,[-8808,3065,0,-1]],
    [null,1,[-8805,3070,0,1]],
    [null,1,[-8804,4450,1,1,0,-1]],
    [null,1,[-8802,4452,-1,-1]],
    [null,1,[-8802,4454,1,0,-1,-2]],
    [null,1,[-8801,4453,0,-1]],
    [null,1,[-8797,4299,0,3]],
    [null,1,[-8792,4301,3,-1,-1,2]],
    [null,1,[-8790,4195,2,-1]],
    [null,1,[-8789,4300,-1,1]],
    [null,1,[-8788,4175,2,1,-1,1]],
    [null,1,[-8788,4197,1,0]],
    [null,1,[-8780,4176,6,0]],
    [null,1,[-8776,4184,2,0]],
    [null,1,[-8774,4175,6,0]],
    [null,1,[-8772,4182,0,-1,4,0]],
    [null,1,[-8770,4183,0,-2]],
    [null,1,[-8769,4184,0,-1]],
    [null,1,[-8769,4184,2,1]],
    [null,1,[-8768,4168,2,0]],
    [null,1,[-8768,4179,5,-1]],
    [null,1,[-8768,4185,0,-1]],
    [null,1,[-8767,4188,0,-4]],
    [null,1,[-8765,4159,1,0]],
    [null,1,[-8765,4160,1,-2]],
    [null,1,[-8764,4180,1,0]],
    [null,1,[-8763,4178,0,1]],
    [null,1,[-8763,4179,1,-1]],
    [null,1,[-8761,3797,1,1]],
    [null,1,[-8759,4171,3,0]],
    [null,1,[-8758,4167,2,0]],
    [null,1,[-8758,4171,0,-5]],
    [null,1,[-8754,4171,-2,-1,4,0]],
    [null,1,[-8721,3041,0,1]],
    [null,1,[-8682,3346,-5,0]],
    [null,1,[-8676,3608,0,2]],
    [null,1,[-8671,3353,1,1]],
    [null,1,[-8627,3973,1,0]],
    [null,1,[-8584,3822,2,0]],
    [null,1,[-8583,3820,-2,1]],
    [null,1,[-8572,3818,0,-2]],
    [null,1,[-8569,3820,0,-1]],
    [null,1,[-8533,3507,0,-2,2,1]],
    [null,1,[-8532,3504,-1,0]],
    [null,1,[-8519,3504,0,-1]],
    [null,1,[-8466,3382,1,0]],
    [null,1,[-8460,3355,2,0]],
    [null,1,[-8454,3910,0,2]],
    [null,1,[-8454,3910,1,0]],
    [null,1,[-8444,3365,2,1,2,-2]],
    [null,1,[-8444,3379,-2,3,-3,-1]],
    [null,1,[-8442,3380,1,1]],
    [null,1,[-8439,3362,1,1]],
    [null,1,[-8437,3374,0,1]],